Sheet: Page1
A1: ОБВАЛКА ГОВЯДИНА Н/К
A2: Обвалка № 94165 от 09.01.2025 г.
A3: Поставщик от : | C3: МЯСОПРОДУКТ-КИРОВОГРАД ООО 08.01.2025
A4: Кол-во: | C4: 6291.32
A5: Голов (шт): | C5: 29
A6: Ср. вес 1 гол. | C6: =R[-2]C/R[-1]C -> 216.94206896551722
A7: Цена: | C7: 112
A8: Сумма: | C8: =R[-4]C*R[-1]C -> 704627.84
A10: Взято на обвалку кг: | C10: 6286.44 | G10: Цена: | H10: 112
A11: Взято на обвалку голов шт: | C11: 29 | G11: Сумма: | H11: =R[-1]C[-5]*R[-1]C -> 704081.27999999991
A12: Ср. вес 1 гол. | C12: =R[-2]C/R[-1]C -> 216.77379310344827
A14: Код | B14: Полуфабрикаты | C14: Кол-во | D14: Цена ПЛАН | E14: Цена ФАКТ | F14: Разница (план-факт) | G14: Сумма | H14: % выхода | I14: Вес П/Ф 1 гол/кг
A15: СО-ГОВ. ДЕЛ-СЫ* зп жил
A16: 258 | B16: ВЫРЕЗКА ГОВ. | C16: 5.5 | D16: 341.43 | E16: 320.26 | F16: 21.17 | G16: 1761.42 | H16: 0.1 | I16: =RC[-6]/R11C3 -> 0.18965517241379309
A17: 4035 | B17: К-БАЛИК бастурма | C17: 40.9 | D17: 306 | E17: 272.77999999999997 | F17: 33.22 | G17: 11156.89 | H17: 0.7 | I17: =RC[-6]/R11C3 -> 1.4103448275862069
A18: 4007 | B18: К-БАЛЫК_ | C18: 82.3 | D18: 220.33 | E18: 208.71 | F18: 11.62 | G18: 17 176,99 | H18: 1.3 | I18: =RC[-6]/R11C3 -> 2.8379310344827586
A19: 4046 | B19: К-ВЫС.СОРТ_* Алан | C19: 1280.7 | D19: 205.51 | E19: 187.99 | F19: 17.52 | G19: 240757.16 | H19: 20.399999999999999 | I19: =RC[-6]/R11C3 -> 44.162068965517243
A20: 4192 | B20: К-ФИЛЕЙ ГОВ. | C20: 34.9 | D20: 312.83999999999997 | E20: 272.77999999999997 | F20: 40.06 | G20: 9520.18 | H20: 0.6 | I20: =RC[-6]/R11C3 -> 1.2034482758620688
A21: Итого СО-ГОВ. ДЕЛ-СЫ* зп жил : | C21: =SUM(R[-5]C:R[-1]C) -> 1444.3000000000002 | G21: 280372.63 | H21: =RC[-5]/R[-11]C[-5] -> 0.22974847449430844 | I21: =RC[-6]/R[-10]C[-6] -> 49.803448275862074
A22: СО-ГОВЯДИНА ПФ* зп жил
A23: 4002 | B23: К- 50/50 | C23: 2121.8000000000002 | D23: 165.16 | E23: 150.77000000000001 | F23: 14.39 | G23: 319907.20000000001 | H23: 33.799999999999997 | I23: =RC[-6]/R11C3 -> 73.16551724137932
A24: 887 | B24: К- 50/50 (рябчик) | C24: 49 | D24: 165.39 | E24: 150.77000000000001 | F24: 14.62 | G24: 7387.81 | H24: 0.8 | I24: =RC[-6]/R11C3 -> 1.6896551724137931
A25: 4227 | B25: К-1 Алан | C25: 508.7 | D25: 180.48 | E25: 163.35 | F25: 17.13 | G25: 83097.94 | H25: 8.1 | I25: =RC[-6]/R11C3 -> 17.541379310344826
A26: 4005 | B26: К-3 ЖИЛКА ГОВЯД.* | C26: 111.1 | D26: 39.299999999999997 | E26: 34.68 | F26: 4.62 | G26: 3852.9 | H26: 1.8 | I26: =RC[-6]/R11C3 -> 3.8310344827586205
A27: 4006 | B27: К-4 ЖИР ГОВЯЖИЙ | C27: 436.8 | D27: 19.78 | E27: 17.760000000000002 | F27: 2.02 | G27: 7758.75 | H27: 6.9 | I27: =RC[-6]/R11C3 -> 15.062068965517241
A28: 4012 | B28: ОБРЕЗЬ ГОВ.кровь | C28: 37.1 | D28: 2.72 | E28: 2.4300000000000002 | F28: 0.28999999999999998 | G28: 90.22 | H28: 0.6 | I28: =RC[-6]/R11C3 -> 1.2793103448275862
A29: Итого СО-ГОВЯДИНА ПФ* зп жил : | C29: =SUM(R[-6]C:R[-1]C) -> 3264.5 | G29: 422094.82 | H29: =RC[-5]/R[-19]C[-5] -> 0.51929231806873211 | I29: =RC[-6]/R[-18]C[-6] -> 112.56896551724138
A30: СО-КОСТИ маг
A31: 4009 | B31: КОСТЬ ГОВ. | C31: 381.2 | D31: 2.57 | E31: 2.33 | F31: 0.24 | G31: 886.7 | H31: 6.1 | I31: =RC[-6]/R11C3 -> 13.144827586206896
A32: 4010 | B32: КОСТЬ ГРУД. ГОВ. | C32: 161 | D32: 2.57 | E32: 2.33 | F32: 0.24 | G32: 374.5 | H32: 2.6 | I32: =RC[-6]/R11C3 -> 5.5517241379310347
A33: 4110 | B33: КОСТЬ ТЕХ. | C33: 887.2 | H33: 14.1 | I33: =RC[-6]/R11C3 -> 30.593103448275862
A34: Итого СО-КОСТИ маг : | C34: =SUM(R[-3]C:R[-1]C) -> 1429.4 | G34: 1261.19 | H34: =RC[-5]/R[-24]C[-5] -> 0.227378293597012 | I34: =RC[-6]/R[-23]C[-6] -> 49.289655172413795
A35: СО-НЕ ВХОД. В ВЫХОД маг
A36: 4217 | B36: БРАК_ | C36: 6.1 | H36: 0.1 | I36: =RC[-6]/R11C3 -> 0.21034482758620687
A37: 4011 | B37: ОБРЕЗЬ ГОВ. | C37: 151.6 | D37: 2.58 | E37: 2.33 | F37: 0.25 | G37: 352.63 | H37: 2.4 | I37: =RC[-6]/R11C3 -> 5.227586206896552
A38: Итого СО-НЕ ВХОД. В ВЫХОД маг : | C38: =SUM(R[-2]C:R[-1]C) -> 157.69999999999999 | G38: 352.63 | H38: =RC[-5]/R[-28]C[-5] -> 2.5085740100915622E-2 | I38: =RC[-6]/R[-27]C[-6] -> 5.4379310344827578
A39: Итого : | C39: =SUM(R[-18]C,R[-10]C,R[-5]C,R[-1]C) -> 6295.9000000000005 | G39: 704081.28 | H39: =RC[-5]/R[-29]C[-5] -> 1.0015048262609683
A41: % Выхода ПФ : | C41: =SUM(R[-20]C,R[-12]C)/R[-31]C -> 0.74904079256304057 | E41: Ср.с/с СО-ГОВ. ДЕЛ-СЫ* зп жил | H41: =R[-20]C[-1]/R[-20]C[-5] -> 194.12354081562 | I41: грн/кг
E42: Ср.с/с СО-ГОВЯДИНА ПФ* зп жил | H42: =R[-13]C[-1]/R[-13]C[-5] -> 129.29845918211058 | I42: грн/кг
E43: Ср.с/с СО-КОСТИ маг | H43: =R[-9]C[-1]/R[-9]C[-5] -> 0.88232125367286973 | I43: грн/кг
E44: Ср.с/с СО-НЕ ВХОД. В ВЫХОД маг | H44: =R[-6]C[-1]/R[-6]C[-5] -> 2.2360811667723528 | I44: грн/кг
E45: ИТОГО ср. с/с ВХОД. В ВЫХОД | H45: =SUM(R[-24]C[-1],R[-16]C[-1])/SUM(R[-24]C[-5],R[-16]C[-5]) -> 149.18184038396194 | I45: грн/кг